source_id,scope,plan_or_group,document_title,document_type,report_year,valuation_date_or_fy_end,local_path,sha256,official_status,selected_for,source_precedence_rank,source_role,source_unit_notes,origin_url,original_filename,local_filename,filename_policy,expected_use,notes,provenance_status
AV_2024,plan,txtrs-av,"Actuarial Valuation Report - 2024",av,2024,2024-08-31,prep/txtrs-av/sources/Texas TRS Valuation 2024.pdf,514d4f604dc70d8e0f5172e19213b126861be5c8d517f767379db74d4e4f1f76,official_renamed_local_copy,latest_official_available,1,authoritative_av,,https://www.trs.texas.gov/files/migrated/actuarial-value-report-2024.pdf,unknown,"Texas TRS Valuation 2024.pdf",canonical_local,"plan provisions; actuarial assumptions; active grid; entrant profile; funding targets","First copied source for fresh AV-first TXTRS intake. Auxiliary estimation-support documents and AV-referenced external references should be added as they are brought into scope.",partial
ACFR_2023,plan,txtrs-av,"TRS ACFR 2023",acfr,2023,2023-08-31,prep/txtrs-av/sources/Texas TRS ACFR 2023.pdf,25ad5953b079f5aeca51ff11bcc7cdf9d47af5e52896fc34899eeb63b8328138,official_renamed_local_copy,gap_fill,2,estimation_support,,,"unknown","Texas TRS ACFR 2023.pdf",canonical_local,"membership counts; retiree totals; reconciliation support","Copied into txtrs-av for reconciliation and possible estimation support. The AV remains the authoritative source document.",partial
EXPSTUDY_2022,plan,txtrs-av,"2022 Actuarial Experience Study",experience_study,2022,2021-08-31,prep/txtrs-av/sources/Texas TRS Actuarial Experience Study 2022.pdf,d2c05d478ec97ef152710c2e6eb4256b5d6ddf348e123da2f62b3b15c74476a4,official_renamed_local_copy,gap_fill,3,supplementary,,https://www.trs.texas.gov/TRS%20Documents/actuarial_experience_study_2022.pdf.pdf,actuarial_experience_study_2022.pdf.pdf,"Texas TRS Actuarial Experience Study 2022.pdf",canonical_local,"mortality methodology; decrement methodology; assumption adoption context","Official TRS experience study now copied into txtrs-av sources. Important for retiree-mortality fallback methodology and assumption provenance.",partial
GASB67_2024,plan,txtrs-av,"GASB Statement No. 67 Reporting and Disclosure Information for the year ending August 31, 2024",gasb,2024,2024-08-31,prep/txtrs-av/sources/Texas TRS GASB 67 2024.pdf,64094793c82ce96c3904b6402d6b893a5ecd6e75d7e0cd02b4002ff28e5fa2fb,official_renamed_local_copy,gap_fill,4,reconciliation_support,,https://www.trs.texas.gov/files/migrated/gasb-report-67-2024.pdf,gasb-report-67-2024.pdf,"Texas TRS GASB 67 2024.pdf",canonical_local,"GASB pension liability and disclosure context; possible later calibration support","Official TRS GASB 67 report now copied into txtrs-av sources. Treated as reconciliation/calibration-support evidence, not as co-equal authority to the AV.",partial
BENEFITS_HANDBOOK,plan,txtrs-av,"TRS Benefits Handbook",handbook,,,prep/txtrs-av/sources/Texas TRS Benefits Handbook.pdf,783de78450a6bce12fcef11828d99693fde6926338fa92331ce29f6f6b44e930,official_renamed_local_copy,plan_admin_authoritative,2,plan_admin_direct,,https://www.trs.texas.gov/files/migrated/benefits_handbook.pdf,benefits_handbook.pdf,"Texas TRS Benefits Handbook.pdf",canonical_local,"member-contribution interest rate; refund rules; vesting and account-balance rules; member-facing plan provisions the AV does not restate","Official TRS member benefits handbook. Plan-administrator-direct authority for items the AV does not restate (e.g., 2% interest credited to member contribution accounts). Document is undated on cover but reflects member contribution rates through 9/1/2024 and references the 2019 Texas Legislative Session phase-in.",partial
